{
  "sessionRequestId":"standalone_session_request_example_001","schemaVersion":"1.0.0","command":"แก้ src/index.mjs แล้วรัน test","repositoryRoot":"C:/repositories/KAVEEP-DEV-AGENT",
  "authoritySnapshot":{"authoritySnapshotId":"authority_snapshot_example_001","schemaVersion":"1.0.0","repositoryRoot":"C:/repositories/KAVEEP-DEV-AGENT","authorityChain":[{"precedence":1,"authorityType":"engineering_constitution","ownerRepository":"KAVEEP-DEV-AGENT","documentRef":"authority_document_constitution"}],"authorityDocuments":[{"documentId":"authority_document_constitution","path":"ENGINEERING-CONSTITUTION.md","sha256":"aaaaaaaaaaaaaaaaaaaaaaaaaaaaaaaaaaaaaaaaaaaaaaaaaaaaaaaaaaaaaaaa","bytes":100,"verificationStatus":"verified"}],"limitations":["Evidence grants no authority."],"warnings":[],"evidenceRefs":["evidence_authority_001"],"status":"verified","createdAt":"2026-07-11T00:00:00.000Z"},
  "missionLock":{"missionLockId":"mission_lock_example_001","schemaVersion":"1.0.0","authoritySnapshotRef":"authority_snapshot_example_001","lockedPrinciples":[{"principleId":"principle_human_authority","name":"Human Authority","statement":"Human authority remains above AI autonomy.","sourceDocumentRef":"authority_document_constitution"}],"protectedArtifacts":[{"path":"ENGINEERING-CONSTITUTION.md","protectionLevel":"governance_locked","reason":"Governance process required."}],"prohibitedAutonomousChanges":["mission","governance"],"kcpRequiredChanges":["architecture"],"humanApprovalRequiredChanges":["source_write_back"],"limitations":["No execution authority."],"status":"active","createdAt":"2026-07-11T00:00:00.000Z"},
  "brain":{"providerId":"openai","model":"explicit-model-id","budget":{"maxContextCharacters":100000,"maxOutputTokens":8000,"maxEdits":20,"timeoutMs":120000},"maxContextFiles":50},
  "sandboxLimits":{"maxFiles":5000,"maxDirectories":1000,"maxTotalBytes":104857600,"maxSingleFileBytes":1048576,"maxDepth":30,"maxPathLength":512,"maxLifetimeSeconds":3600},
  "workspaceIndex":{"enabled":true,"indexRoot":"C:/kaveep-data/workspace-index","limits":{"maxFiles":20000,"maxDirectories":5000,"maxDepth":30,"maxFileBytes":1048576},"retrieval":{"maxResults":20,"maxSnippetCharacters":1000,"maxContextCharacters":20000}},
  "loop":{"maxAttempts":3,"semanticMaxAttempts":2,"maxSemanticFeedbackCharacters":20000},
  "container":{"enabled":true,"required":true,"executionProfile":"node","image":"node:22-bookworm-slim","allowedImages":["node:22-bookworm-slim"],"operations":["lint","typecheck","test","build"],"limits":{"timeoutMsPerOperation":120000,"maxOutputBytes":1048576,"memoryMb":2048,"cpus":2,"pids":256}},
  "status":"proposed","createdAt":"2026-07-11T00:00:00.000Z"
}
